credential_id,name,issuer,cluster,sub_cluster,cross_cutting_tags,grade_band,exam_format,current_version,version_effective_date,objectives_source_url,objective_count,tx_ibc,fl_cape,oh_irc,anchor_candidate,notes
comptia-itf-plus,CompTIA IT Fundamentals+,CompTIA,Digital Technology,IT Support & Services,,HS,"CBT, 75 items, 60 min, multiple choice",FC0-U61,2018-09,https://www.comptia.org/certifications/it-fundamentals,~80 across 6 domains,yes,yes,yes,yes,Pre-A+ entry credential; common 9th/10th-grade introduction.
comptia-a-plus,CompTIA A+,CompTIA,Digital Technology,IT Support & Services,,Both,"CBT, two exams (Core 1 + Core 2), performance-based + multiple choice",220-1201 / 220-1202,2025-09,https://www.comptia.org/certifications/a,~270 across 4 domains per exam,yes,yes,yes,yes,"Industry-standard IT support technician credential. Most-prepped IT credential in U.S. CTE. Revises every 3 years."
google-it-support,Google IT Support Professional Certificate,Google (via Coursera),Digital Technology,IT Support & Services,,Both,Course completion + graded assessments across 5 courses,rolling (continuous updates),rolling,https://www.coursera.org/professional-certificates/google-it-support,5 courses with multi-week content,yes,yes,yes,yes,Course-completion credential rather than exam credential. Stackable to CompTIA A+. Strong employer recognition through Google Employer Consortium.
cisco-ccst-it-support,Cisco Certified Support Technician (CCST) IT Support,Cisco,Digital Technology,IT Support & Services,,Both,"CBT, 50 min",CCST IT Support (single current version),2023,https://www.cisco.com/site/us/en/learn/training-certifications/certifications/technician/it-support/index.html,~30-40,verify,verify,verify,maybe,Newer credential (2023 launch); growing state-list adoption. Siblings: CCST Networking and CCST Cybersecurity (different sub-clusters).
ms-900,Microsoft 365 Fundamentals (MS-900),Microsoft,Digital Technology,IT Support & Services,Digital Technology → Web & Cloud,Both,"CBT, ~40-60 items, 45 min",MS-900,2019,https://learn.microsoft.com/en-us/credentials/certifications/exams/ms-900/,~30-40,yes,yes,yes,no,Entry Microsoft 365 / cloud services fundamentals. Primary home is Web & Cloud; listed here because IT Support teachers use it.
itil-4-foundation,ITIL 4 Foundation,PeopleCert (on behalf of AXELOS),Digital Technology,IT Support & Services,Management & Entrepreneurship → Leadership & Operations,PS,"CBT, 40 multiple-choice, 60 min",ITIL 4 Foundation,2019-02,https://www.peoplecert.org/browse-certifications/it-governance-and-service-management/ITIL-1/itil-4-foundation-8,~30 learning outcomes across 7 domains,yes,yes,verify,no,IT service management foundation. Stronger PS/college fit than HS.
testout-pc-pro,TestOut PC Pro,TestOut (a CompTIA company since 2022),Digital Technology,IT Support & Services,,HS,Performance-based simulation + multiple choice,PC Pro,rolling,https://w3.testout.com/k12/certifications/pc-pro,~10 domains,yes,yes,yes,no,Performance-simulation heavy. Aligns closely to CompTIA A+ content post-acquisition. Common in HS CTE labs.
